{
  "blocks": [
    {
      "data": {
        "section_key": "c1_heading",
        "text": "C1 — Contextualizar"
      },
      "id": "heading-c1",
      "type": "heading"
    },
    {
      "citation_ids": [
        "FIC-01"
      ],
      "data": {
        "section_key": "c1",
        "text": "No encontro fictício, a equipe apresentou o desafio e registrou dúvidas sobre origem das devoluções."
      },
      "id": "c1",
      "type": "paragraph"
    },
    {
      "data": {
        "section_key": "c2_heading",
        "text": "C2 — Compreender"
      },
      "id": "heading-c2",
      "type": "heading"
    },
    {
      "citation_ids": [
        "FIC-01"
      ],
      "data": {
        "section_key": "c2",
        "text": "Cinco participantes fictícios descreveram etapas que funcionam e dificuldades de acompanhamento. Com três votos por pessoa, foram registrados 15 votos em temas priorizados."
      },
      "id": "c2",
      "type": "paragraph"
    },
    {
      "data": {
        "section_key": "c3_heading",
        "text": "C3 — Confirmar"
      },
      "id": "heading-c3",
      "type": "heading"
    },
    {
      "citation_ids": [
        "FIC-01"
      ],
      "data": {
        "section_key": "c3",
        "text": "O grupo simulado descreveu experiência desejada com confirmação clara de envio e status visível, além de critérios observáveis."
      },
      "id": "c3",
      "type": "paragraph"
    },
    {
      "data": {
        "section_key": "c4_heading",
        "text": "C4 — Cocriar"
      },
      "id": "heading-c4",
      "type": "heading"
    },
    {
      "citation_ids": [
        "FIC-01"
      ],
      "data": {
        "section_key": "c4",
        "text": "Ideias individuais fictícias originaram propostas de orientação, formulário guiado e acompanhamento; benefícios são expectativas, não resultados."
      },
      "id": "c4",
      "type": "paragraph"
    },
    {
      "data": {
        "section_key": "c5_heading",
        "text": "C5 — Conduzir"
      },
      "id": "heading-c5",
      "type": "heading"
    },
    {
      "citation_ids": [
        "FIC-01"
      ],
      "data": {
        "section_key": "c5",
        "text": "Cinco participantes fictícios distribuíram dez créditos cada, totalizando 50. O ranking orienta investigação, sem comprovar viabilidade ou impacto."
      },
      "id": "c5",
      "type": "paragraph"
    },
    {
      "citation_ids": [
        "FIC-01"
      ],
      "data": {
        "headers": [
          "Tema",
          "Votos"
        ],
        "rows": [
          [
            "Acompanhamento",
            "6"
          ],
          [
            "Clareza do pedido",
            "5"
          ],
          [
            "Devoluções",
            "4"
          ]
        ],
        "title": "C2 — temas priorizados, exemplo fictício"
      },
      "id": "themes-votes",
      "type": "table"
    },
    {
      "citation_ids": [
        "FIC-02"
      ],
      "data": {
        "headers": [
          "Proposta",
          "Créditos",
          "Próxima verificação"
        ],
        "rows": [
          [
            "Status visível",
            "24",
            "Protótipo"
          ],
          [
            "Formulário guiado",
            "18",
            "Teste de tarefa"
          ],
          [
            "Orientação prévia",
            "8",
            "Entrevista"
          ]
        ],
        "title": "C5 — distribuição de 50 créditos fictícios"
      },
      "id": "proposal-credits",
      "type": "table"
    }
  ],
  "citations": [
    {
      "id": "FIC-01",
      "locator": "exemplo fictício, sem coleta real",
      "source_id": "ata-simulada-5c"
    },
    {
      "id": "FIC-02",
      "locator": "exemplo fictício, sem dados reais",
      "source_id": "planilha-simulada"
    }
  ],
  "deliverable_type": "five_c_workshop_record",
  "locale": "pt-BR",
  "metadata": {
    "artifact_id": "sample-five-c-workshop-record",
    "completeness": "complete",
    "content_version": "1.0.0",
    "orientation": "landscape",
    "sample": true
  },
  "schema_version": "1.0.0",
  "summary": "Amostra de validação visual e estrutural. Dados, pessoas, votos e resultados são fictícios.",
  "title": "EXEMPLO FICTÍCIO — Encontro com clientes sobre solicitações de dados"
}
