{
  "schema_version": "1.0.0",
  "deliverable_type": "briefing",
  "locale": "pt-BR",
  "title": "EXEMPLO FICTÍCIO: Melhorar a experiencia de solicitacoes internas",
  "summary": "Amostra fictícia do formato original RC6. Não descreve um projeto real. Entrevista Inicial de sete campos usada como exemplo neutro do contrato canônico.",
  "blocks": [
    {
      "id": "challenge-title",
      "type": "heading",
      "data": {
        "section_key": "challenge_title",
        "text": "Melhorar a experiencia de solicitacoes internas"
      }
    },
    {
      "id": "challenge",
      "type": "callout",
      "data": {
        "section_key": "challenge",
        "text": "Como podemos reduzir o esforco de quem solicita e de quem atende para que as demandas sejam resolvidas com clareza de modo que o processo seja previsivel?"
      },
      "citation_ids": [
        "FIC-01"
      ]
    },
    {
      "id": "problem-opportunity",
      "type": "rich_text",
      "data": {
        "section_key": "problem_opportunity",
        "title": "Descricao detalhada do problema ou oportunidade",
        "description": "As solicitacoes chegam por canais diferentes e sem informacoes padronizadas, gerando retrabalho para solicitantes e equipes de atendimento.",
        "points": [
          "As fontes fornecidas relatam duplicidade de pedidos.",
          "O prazo de atendimento nao e visivel para quem solicita."
        ]
      },
      "citation_ids": [
        "FIC-01"
      ]
    },
    {
      "id": "business-relevance",
      "type": "rich_text",
      "data": {
        "section_key": "business_relevance",
        "title": "Justificativa da relevancia",
        "description": "O problema consome capacidade operacional e reduz a confianca no processo interno.",
        "points": [
          "A melhoria esta ligada a eficiencia operacional descrita nas fontes.",
          "A previsibilidade influencia a experiencia das equipes envolvidas."
        ]
      },
      "citation_ids": [
        "FIC-01"
      ]
    },
    {
      "id": "expected-outcomes",
      "type": "rich_text",
      "data": {
        "section_key": "expected_outcomes",
        "title": "Resultados esperados",
        "description": "Reduzir retrabalho e tornar o andamento das solicitacoes compreensivel.",
        "points": [
          "Diminuir solicitacoes devolvidas por falta de informacao.",
          "Permitir acompanhamento de status pelo solicitante."
        ]
      },
      "citation_ids": [
        "FIC-01"
      ]
    },
    {
      "id": "responsible",
      "type": "paragraph",
      "data": {
        "section_key": "responsible",
        "name": "Nao informado",
        "description": "Responsavel ainda nao identificado nas fontes."
      },
      "citation_ids": [
        "FIC-01"
      ]
    },
    {
      "id": "sponsor",
      "type": "paragraph",
      "data": {
        "section_key": "sponsor",
        "name": "Nao informado",
        "description": "Sponsor ainda nao identificado nas fontes."
      },
      "citation_ids": [
        "FIC-01"
      ]
    }
  ],
  "citations": [
    {
      "id": "FIC-01",
      "source_id": "ata-simulada-5c",
      "locator": "exemplo fictício, sem coleta real"
    }
  ],
  "metadata": {
    "phase_key": "problem_understanding",
    "generation_mode": "structured",
    "source_version_ids": [],
    "artifact_id": "sample-briefing",
    "content_version": "1.0.0",
    "completeness": "complete",
    "orientation": "portrait",
    "sample": true
  }
}
