{
  "schema_version": "1.0.0",
  "deliverable_type": "cdt_analysis",
  "locale": "pt-BR",
  "title": "EXEMPLO FICTÍCIO: Formulário guiado para pedidos de dados históricos",
  "summary": "Amostra de validação visual e estrutural. Dados, pessoas e resultados são fictícios.",
  "blocks": [
    {
      "id": "heading-readiness",
      "type": "heading",
      "data": {
        "section_key": "readiness_heading",
        "text": "Estado da CDT"
      }
    },
    {
      "id": "readiness",
      "type": "paragraph",
      "data": {
        "section_key": "readiness",
        "text": "Pronta para envio. As cinco perguntas da Descrição estão respondidas, sem ponto em aberto, e os seis itens do checklist estão atendidos. Principal ponto fraco: a meta de horas foi medida só no piloto."
      },
      "citation_ids": [
        "FIC-01"
      ]
    },
    {
      "id": "heading-publication_checklist",
      "type": "heading",
      "data": {
        "section_key": "publication_checklist_heading",
        "text": "Checklist do comunicado"
      }
    },
    {
      "id": "publication_checklist",
      "type": "paragraph",
      "data": {
        "section_key": "publication_checklist",
        "text": "- Problema e objetivo: atendido. Descrição, primeira e quarta perguntas.\n- Públicos impactados: atendido. Descrição, segunda pergunta.\n- Entregas essenciais: atendido. Descrição, quinta pergunta.\n- Prioridades e resultados esperados: atendido. Descrição, quarta e quinta perguntas; a meta de horas é proposta.\n- Regras, restrições e dependências: atendido. Campos obrigatórios variam por tipo de pedido; os pedidos trazem nome e telefone de contatos (dados pessoais); o acesso externo segue a autenticação da Tecnologia.\n- Responsáveis: atendido. Nossa coordenação de atendimento esclarece dúvidas e valida as entregas; eu, como gerente, decido mudanças de escopo."
      },
      "citation_ids": [
        "FIC-01",
        "FIC-02"
      ]
    },
    {
      "id": "heading-data_to_obtain",
      "type": "heading",
      "data": {
        "section_key": "data_to_obtain_heading",
        "text": "O que obter e analisar primeiro"
      }
    },
    {
      "id": "data_to_obtain",
      "type": "paragraph",
      "data": {
        "section_key": "data_to_obtain",
        "text": "Nenhum dado pendente para o envio. Antes da conversa com a Tecnologia, vale obter e analisar, nesta ordem:"
      },
      "citation_ids": [
        "FIC-02"
      ]
    },
    {
      "id": "data_to_obtain-table",
      "type": "table",
      "data": {
        "headers": [
          "Prioridade",
          "Dado",
          "Por que importa",
          "Com quem",
          "Pergunta",
          "Impede o envio?"
        ],
        "rows": [
          [
            "1",
            "Campos por tipo de pedido",
            "Define o essencial do formulário",
            "Equipe de atendimento",
            "Quais campos cada tipo de pedido exige?",
            "Não"
          ],
          [
            "2",
            "Horas mensais com complementos",
            "Sustenta a meta dos Benefícios",
            "Gestão da área",
            "Quantas horas por mês a equipe gasta hoje com complementos?",
            "Não"
          ]
        ]
      }
    },
    {
      "id": "heading-quality_review",
      "type": "heading",
      "data": {
        "section_key": "quality_review_heading",
        "text": "Avaliação crítica"
      }
    },
    {
      "id": "quality_review",
      "type": "paragraph",
      "data": {
        "section_key": "quality_review",
        "text": "Pontos fortes: problema com frequência estimada e escopo em três grupos.\nPontos fracos: meta de horas proposta, medida só no piloto com 8 analistas; regra de campos por tipo de pedido ainda não detalhada.\nPerguntas que a Tecnologia deve fazer: quais campos cada tipo de pedido exige (checklist, regras); quem homologa (checklist, responsáveis)."
      },
      "citation_ids": [
        "FIC-01"
      ]
    },
    {
      "id": "heading-traceability",
      "type": "heading",
      "data": {
        "section_key": "traceability_heading",
        "text": "Origem dos dados"
      }
    },
    {
      "id": "traceability",
      "type": "paragraph",
      "data": {
        "section_key": "traceability",
        "text": "Fonte de cada campo da CDT; todas são fictícias."
      },
      "citation_ids": [
        "FIC-01",
        "FIC-02"
      ]
    },
    {
      "id": "traceability-table",
      "type": "table",
      "data": {
        "headers": [
          "Campo",
          "Fonte",
          "Natureza",
          "Limite"
        ],
        "rows": [
          [
            "Descrição: problema",
            "FIC-01: Briefing simulado",
            "estimativa",
            "exemplo"
          ],
          [
            "Descrição: processo atual",
            "FIC-02: Relatório 4D simulado",
            "documentado",
            "exemplo"
          ],
          [
            "Descrição: resultado e prioridade",
            "FIC-03: Relatório final simulado",
            "decidido",
            "prevalece sobre o 3E"
          ],
          [
            "Justificativa",
            "FIC-01: Briefing simulado",
            "relatado",
            "exemplo"
          ],
          [
            "Benefícios",
            "FIC-03: Relatório final simulado",
            "medido no piloto",
            "8 analistas"
          ]
        ]
      }
    }
  ],
  "citations": [
    {
      "id": "FIC-01",
      "source_id": "briefing-simulado",
      "locator": "exemplo fictício, sem dados reais"
    },
    {
      "id": "FIC-02",
      "source_id": "relatorio-4d-simulado",
      "locator": "exemplo fictício, sem coleta real"
    },
    {
      "id": "FIC-03",
      "source_id": "relatorio-final-simulado",
      "locator": "exemplo fictício, sem decisão real"
    }
  ],
  "metadata": {
    "artifact_id": "sample-cdt-analise",
    "content_version": "1.3.0",
    "completeness": "complete",
    "orientation": "portrait",
    "sample": true
  }
}
